{
  "$schema": "https://json-schema.org/draft/2020-12/schema",
  "$id": "urn:agentskills:schema:install-state:v1",
  "title": "Cumasach Install State v1",
  "type": "object",
  "additionalProperties": false,
  "required": [
    "schemaVersion",
    "target",
    "active",
    "history"
  ],
  "properties": {
    "schemaVersion": {
      "const": "v1"
    },
    "target": {
      "type": "object",
      "additionalProperties": false,
      "required": [
        "path"
      ],
      "properties": {
        "path": {
          "type": "string",
          "minLength": 1
        },
        "runtime": {
          "type": "string",
          "minLength": 1
        }
      }
    },
    "active": {
      "type": "array",
      "items": {
        "type": "object",
        "additionalProperties": false,
        "required": [
          "name",
          "version",
          "digest",
          "source"
        ],
        "properties": {
          "name": {
            "type": "string",
            "pattern": "^[a-z0-9]([a-z0-9._-]*[a-z0-9])?$"
          },
          "version": {
            "type": "string",
            "minLength": 1
          },
          "digest": {
            "type": "string",
            "pattern": "^sha256:[a-f0-9]{64}$"
          },
          "source": {
            "type": "string",
            "minLength": 1
          }
        }
      }
    },
    "history": {
      "type": "array",
      "items": {
        "type": "object",
        "additionalProperties": false,
        "required": [
          "timestamp",
          "action",
          "resolved"
        ],
        "properties": {
          "timestamp": {
            "type": "string",
            "format": "date-time"
          },
          "action": {
            "type": "string",
            "enum": [
              "install",
              "upgrade",
              "rollback",
              "remove"
            ]
          },
          "resolved": {
            "type": "array",
            "items": {
              "type": "object",
              "additionalProperties": false,
              "required": [
                "name",
                "version",
                "digest"
              ],
              "properties": {
                "name": {
                  "type": "string",
                  "pattern": "^[a-z0-9]([a-z0-9._-]*[a-z0-9])?$"
                },
                "version": {
                  "type": "string",
                  "minLength": 1
                },
                "digest": {
                  "type": "string",
                  "pattern": "^sha256:[a-f0-9]{64}$"
                }
              }
            }
          }
        }
      }
    }
  }
}
